{
  "package": {
    "profile_id": "fedramp_20x_program",
    "title": "FedRAMP 20x Class C fixture",
    "prepared_for": "Fixture Customer",
    "reporting_period": null
  },
  "system": {
    "display_name": "Fixture CSO",
    "authorization_boundary": "Public SaaS boundary for fixture only.",
    "mission_summary": "Internal qualification fixture.",
    "impact_level": null,
    "authorization_path": "fedramp"
  },
  "contacts": {
    "system_owner": [],
    "isso": [],
    "issm": [],
    "control_owners": [],
    "assessors": [],
    "approvers": []
  },
  "control_set": {
    "source": {},
    "tailoring": [],
    "organization_defined_parameters": {},
    "inheritance": []
  },
  "security_controls": {},
  "evidence": {},
  "findings": {},
  "poam_candidates": {},
  "assessor_inputs": {
    "independent-assessment": {
      "owner": "assessor",
      "import_only": true,
      "summary": "Imported independent assessment fixture."
    }
  },
  "privacy": {
    "artifacts_present": true,
    "scope_notice": "External privacy review required."
  },
  "fedramp_20x": {
    "cpo": {
      "serviceIdentification": {
        "providerName": "Fixture Provider",
        "serviceName": "Fixture Service",
        "serviceAcronym": "FS",
        "serviceDescription": "Internal test fixture only.",
        "certificationType": "20x",
        "fedRampPackageId": "FIXTURE-001",
        "website": "https://example.test/fixture",
        "logo": "https://example.test/fixture/logo.png"
      },
      "serviceProperties": {
        "serviceType": ["SaaS"],
        "deploymentModel": "Public Cloud",
        "digitalIdentityLevel": "IAL2"
      },
      "contactInformation": [
        {
          "contactType": "Security",
          "name": "Fixture Security",
          "title": "ISSO",
          "organization": "Fixture Provider",
          "email": "security@example.test",
          "phone": "555-0101"
        },
        {
          "contactType": "Sales",
          "name": "Fixture Sales",
          "title": "Sales",
          "organization": "Fixture Provider",
          "email": "sales@example.test",
          "phone": "555-0102"
        }
      ],
      "assessor": {
        "name": "Fixture Assessor Org",
        "id": "FIXTURE-ASSESSOR"
      }
    },
    "sdr": {
      "certificationPackageOverviewUri": "https://example.test/fixture/cpo.json",
      "fedRampRequirements": []
    },
    "ocr": {
      "certificationPackageOverviewUri": "https://example.test/fixture/cpo.json",
      "reportPeriod": {
        "from": "2026-01-01",
        "to": "2026-03-31"
      },
      "certificationDataChanges": [],
      "plannedCertificationDataChanges": {
        "planningHorizonThrough": "2026-12-31",
        "changes": []
      },
      "acceptedVulnerabilities": "None reported in fixture.",
      "transformativeChanges": [],
      "updatedRecommendations": [],
      "activeAgencies": [],
      "reportableIncidents": {}
    },
    "scg": {
      "reference_uri": "https://example.test/fixture/scg"
    },
    "ksi_methods": [
      {
        "method_id": "KSI-1",
        "name": "Fixture validation method"
      }
    ],
    "metric_history": [
      {
        "period": "2026-Q1",
        "status": "imported"
      }
    ],
    "independent_assessment": {
      "assessor_name": "Fixture Assessor Org",
      "imported_summary": "Assessor-owned import fixture only."
    }
  },
  "fedramp_rev5_transition": null,
  "fisma_agency_security": null,
  "extensions": {}
}
