{
  "package": {
    "profile_id": "fisma_agency_security",
    "title": "Synthetic FISMA Agency Security Plan Excerpt",
    "prepared_for": "Portal demo",
    "reporting_period": null
  },
  "system": {
    "display_name": "Customer Records Portal",
    "authorization_boundary": "Single VPC with managed PostgreSQL and object storage",
    "mission_summary": "Internal web application for agency case management.",
    "impact_level": "moderate",
    "authorization_path": "agency"
  },
  "contacts": {
    "system_owner": [
      {
        "name": "Demo Owner",
        "role": "system_owner",
        "email": "demo.owner@agency.example"
      }
    ],
    "isso": [],
    "issm": [],
    "control_owners": [],
    "assessors": [],
    "approvers": []
  },
  "control_set": {
    "source": {},
    "tailoring": [],
    "organization_defined_parameters": {},
    "inheritance": []
  },
  "security_controls": {
    "AC-1": {
      "implementation_status": "implemented",
      "implementation_statement": "Access control policy reviewed annually.",
      "responsible_parties": [
        "ISSO"
      ],
      "evidence_links": [
        "agency_security_plan"
      ]
    }
  },
  "evidence": {
    "agency_security_plan": {
      "document_type": "security_plan_excerpt"
    }
  },
  "findings": {},
  "poam_candidates": {},
  "assessor_inputs": {},
  "privacy": {
    "artifacts_present": false,
    "scope_notice": "Privacy review is external to this product."
  },
  "fedramp_20x": null,
  "fedramp_rev5_transition": null,
  "fisma_agency_security": {
    "security_plan_sections": {}
  },
  "extensions": {}
}
