{
  "package": {
    "profile_id": "fisma_agency_security",
    "title": "Agency FISMA qualification fixture",
    "prepared_for": "Fixture Customer",
    "reporting_period": null
  },
  "system": {
    "display_name": "Customer Records Portal",
    "authorization_boundary": "Single VPC for qualification fixture only.",
    "mission_summary": "Synthetic agency security-only package for deterministic E2E.",
    "impact_level": "moderate",
    "authorization_path": "agency"
  },
  "contacts": {
    "system_owner": [],
    "isso": [],
    "issm": [],
    "control_owners": [],
    "assessors": [],
    "approvers": []
  },
  "control_set": {
    "source": {},
    "tailoring": [],
    "organization_defined_parameters": {},
    "inheritance": []
  },
  "security_controls": {
    "AC-1": {
      "implementation_status": "implemented",
      "implementation_statement": "Access control policy reviewed annually.",
      "responsible_parties": [],
      "evidence_links": []
    }
  },
  "evidence": {},
  "findings": {},
  "poam_candidates": {},
  "assessor_inputs": {
    "sar_excerpt": {
      "owner": "assessor",
      "import_only": true,
      "summary": "Assessor-owned import fixture only."
    }
  },
  "privacy": {
    "artifacts_present": false,
    "scope_notice": "Privacy review is external to this product."
  },
  "fedramp_20x": null,
  "fedramp_rev5_transition": null,
  "fisma_agency_security": {
    "security_plan_sections": {}
  },
  "extensions": {}
}
